<?xml version="1.0" encoding="UTF-8"?>
<targetParts
	xsi:schemaLocation="http://openstm32.org/stm32TargetDefinitions stm32TargetDefinitions.xsd"
	xmlns:xsi="http://www.w3.org/2001/XMLSchema-instance"
	xmlns="http://openstm32.org/stm32TargetDefinitions">
	<!--version = v1.0.0 -->
  <board>
    <name>STM32MP157C-EV1</name>
    <status>ST Secret</status>
    <parent>stm32mp157caax</parent>
    <dbgDEV>st-linkv2-1</dbgDEV>
    <CDefines >
      <CDefine>-DSTM32MP15xx_EVAL</CDefine>
      <CDefine>-DSTM32MP157C_EV1</CDefine>
    </CDefines>
  </board>
  <board>
    <name>STM32MP157A-EV1</name>
    <status>ST Secret</status>
    <parent>stm32mp157aaax</parent>
    <dbgDEV>st-linkv2-1</dbgDEV>
    <CDefines >
      <CDefine>-DSTM32MP15xx_EVAL</CDefine>
      <CDefine>-DSTM32MP157A_EV1</CDefine>
    </CDefines>
  </board>
  <board>
    <name>STM32MP157C-DK2</name>
    <status>ST Secret</status>
    <parent>stm32mp157cacx</parent>
    <dbgDEV>st-linkv2-1</dbgDEV>
    <CDefines >
      <CDefine>-DSTM32MP15xx_DISCO</CDefine>
      <CDefine>-DSTM32MP157C_DK2</CDefine>
    </CDefines>
  </board>
  <board>
    <name>STM32MP157A-DK1</name>
    <status>ST Secret</status>
    <parent>stm32mp157aacx</parent>
    <dbgDEV>st-linkv2-1</dbgDEV>
    <CDefines >
      <CDefine>-DSTM32MP15xx_DISCO</CDefine>
      <CDefine>-DSTM32MP157A_DK1</CDefine>
    </CDefines>
  </board>
	

  <mcu>
    <name>STM32MP151AAAx</name>
    <status>ST Secret</status>
    <parent>stm32mp1</parent>
		<cpus>
			<cpu>
				<name>Co-Pro ARM Cortex-M4</name>
				<shortname>CM4</shortname>
				<id>0</id>
				<cores>
					<core>
						<id>0</id>
						<type>arm cortex-m4</type>
						<fpu>fpv4-sp-d16</fpu>
						<maxFrequency>216000</maxFrequency>
					</core>
				</cores>
			</cpu>
			<cpu>
				<name>Main-Pro dual ARM Cortex-A7</name>
				<shortname>x2CA7</shortname>
				<id>1</id>
				<cores>
					<core>
						<id>1</id>
						<type>arm cortex-a7</type>
						<fpu>vfpv4_d16</fpu>
						<maxFrequency>1000000</maxFrequency>
					</core>
					<core>
						<id>2</id>
						<type>arm cortex-a7</type>
						<fpu>vfpv4_d16</fpu>
						<maxFrequency>1000000</maxFrequency>
					</core>
				</cores>
			</cpu>
		</cpus>
    <memories >
      <memory>
		<type>ram</type>
        <name>RAM</name>
        <address>0x10000000</address>
        <!--size from xml = 0x0-->
        <size>0x40000</size>
        <!--end = 0x0-->
      </memory>
      <memory>
		<type>ram</type>
        <name>RETRAM</name>
        <address>0x00000000</address>
        <size>0x10000</size>
        <!--end = 0x0-->
      </memory>
    </memories>
    <svd>
     <name>STM32MP15xxx.svd</name>
      <version>v1r2</version>
      <url></url>
    </svd>
    <CDefines >
      <CDefine>-DSTM32MP15xx</CDefine>
      <CDefine>-DSTM32MP151AAAx</CDefine>
    </CDefines>
    <peripherals >
      <peripheral>ADC1</peripheral>
      <peripheral>ADC2</peripheral>
      <peripheral>BSEC</peripheral>
      <peripheral>CRC1</peripheral>
      <peripheral>CRC2</peripheral>
      <peripheral>DAC1</peripheral>
      <peripheral>DBGMCU</peripheral>
      <peripheral>DCMI</peripheral>
      <peripheral>DDR</peripheral>
      <peripheral>DFSDM1</peripheral>
      <peripheral>DTS</peripheral>
      <peripheral>ETH1</peripheral>
      <peripheral>ETZPC</peripheral>
      <peripheral>FMC</peripheral>
      <peripheral>FREERTOS</peripheral>
      <peripheral>HASH1</peripheral>
      <peripheral>HASH2</peripheral>
      <peripheral>HDMI_CEC</peripheral>
      <peripheral>HDP</peripheral>
      <peripheral>HSEM</peripheral>
      <peripheral>I2C1</peripheral>
      <peripheral>I2C2</peripheral>
      <peripheral>I2C3</peripheral>
      <peripheral>I2C4</peripheral>
      <peripheral>I2C5</peripheral>
      <peripheral>I2C6</peripheral>
      <peripheral>I2S1</peripheral>
      <peripheral>I2S2</peripheral>
      <peripheral>I2S3</peripheral>
      <peripheral>IPCC</peripheral>
      <peripheral>IWDG1</peripheral>
      <peripheral>IWDG2</peripheral>
      <peripheral>LPTIM1</peripheral>
      <peripheral>LPTIM2</peripheral>
      <peripheral>LPTIM3</peripheral>
      <peripheral>LPTIM4</peripheral>
      <peripheral>LPTIM5</peripheral>
      <peripheral>LTDC</peripheral>
      <peripheral>OPENAMP</peripheral>
      <peripheral>PWR</peripheral>
      <peripheral>QUADSPI</peripheral>
      <peripheral>RCC</peripheral>
      <peripheral>RESMGR_UTILITY</peripheral>
      <peripheral>RNG1</peripheral>
      <peripheral>RNG2</peripheral>
      <peripheral>RTC</peripheral>
      <peripheral>SAI1</peripheral>
      <peripheral>SAI2</peripheral>
      <peripheral>SAI3</peripheral>
      <peripheral>SAI4</peripheral>
      <peripheral>SDMMC1</peripheral>
      <peripheral>SDMMC2</peripheral>
      <peripheral>SDMMC3</peripheral>
      <peripheral>SPDIFRX</peripheral>
      <peripheral>SPI1</peripheral>
      <peripheral>SPI2</peripheral>
      <peripheral>SPI3</peripheral>
      <peripheral>SPI4</peripheral>
      <peripheral>SPI5</peripheral>
      <peripheral>SPI6</peripheral>
      <peripheral>SYS</peripheral>
      <peripheral>TAMP</peripheral>
      <peripheral>TIM1</peripheral>
      <peripheral>TIM2</peripheral>
      <peripheral>TIM3</peripheral>
      <peripheral>TIM4</peripheral>
      <peripheral>TIM5</peripheral>
      <peripheral>TIM6</peripheral>
      <peripheral>TIM7</peripheral>
      <peripheral>TIM8</peripheral>
      <peripheral>TIM12</peripheral>
      <peripheral>TIM13</peripheral>
      <peripheral>TIM14</peripheral>
      <peripheral>TIM15</peripheral>
      <peripheral>TIM16</peripheral>
      <peripheral>TIM17</peripheral>
      <peripheral>UART4</peripheral>
      <peripheral>UART5</peripheral>
      <peripheral>UART7</peripheral>
      <peripheral>UART8</peripheral>
      <peripheral>USART1</peripheral>
      <peripheral>USART2</peripheral>
      <peripheral>USART3</peripheral>
      <peripheral>USART6</peripheral>
      <peripheral>USBH_HS1</peripheral>
      <peripheral>USBH_HS2</peripheral>
      <peripheral>USB_OTG_HS</peripheral>
      <peripheral>VREFBUF</peripheral>
      <peripheral>WWDG1</peripheral>
      <peripheral>GPIO</peripheral>
    </peripherals>
  </mcu>

  <mcu>
    <name>STM32MP151AABx</name>
    <status>ST Secret</status>
    <parent>stm32mp1</parent>
		<cpus>
			<cpu>
				<name>Co-Pro ARM Cortex-M4</name>
				<shortname>CM4</shortname>
				<id>0</id>
				<cores>
					<core>
						<id>0</id>
						<type>arm cortex-m4</type>
						<fpu>fpv4-sp-d16</fpu>
						<maxFrequency>216000</maxFrequency>
					</core>
				</cores>
			</cpu>
			<cpu>
				<name>Main-Pro dual ARM Cortex-A7</name>
				<shortname>x2CA7</shortname>
				<id>1</id>
				<cores>
					<core>
						<id>1</id>
						<type>arm cortex-a7</type>
						<fpu>vfpv4_d16</fpu>
						<maxFrequency>1000000</maxFrequency>
					</core>
					<core>
						<id>2</id>
						<type>arm cortex-a7</type>
						<fpu>vfpv4_d16</fpu>
						<maxFrequency>1000000</maxFrequency>
					</core>
				</cores>
			</cpu>
		</cpus>
    <memories >
      <memory>
		<type>ram</type>
        <name>RAM</name>
        <address>0x10000000</address>
        <!--size from xml = 0x0-->
        <size>0x40000</size>
        <!--end = 0x0-->
      </memory>
      <memory>
		<type>ram</type>
        <name>RETRAM</name>
        <address>0x00000000</address>
        <size>0x10000</size>
        <!--end = 0x0-->
      </memory>
    </memories>
    <svd>
     <name>STM32MP15xxx.svd</name>
      <version>v1r2</version>
      <url></url>
    </svd>
    <CDefines >
      <CDefine>-DSTM32MP15xx</CDefine>
      <CDefine>-DSTM32MP151AABx</CDefine>
    </CDefines>
    <peripherals >
      <peripheral>ADC1</peripheral>
      <peripheral>ADC2</peripheral>
      <peripheral>BSEC</peripheral>
      <peripheral>CRC1</peripheral>
      <peripheral>CRC2</peripheral>
      <peripheral>DAC1</peripheral>
      <peripheral>DBGMCU</peripheral>
      <peripheral>DCMI</peripheral>
      <peripheral>DDR</peripheral>
      <peripheral>DFSDM1</peripheral>
      <peripheral>DTS</peripheral>
      <peripheral>ETH1</peripheral>
      <peripheral>ETZPC</peripheral>
      <peripheral>FMC</peripheral>
      <peripheral>FREERTOS</peripheral>
      <peripheral>HASH1</peripheral>
      <peripheral>HASH2</peripheral>
      <peripheral>HDMI_CEC</peripheral>
      <peripheral>HDP</peripheral>
      <peripheral>HSEM</peripheral>
      <peripheral>I2C1</peripheral>
      <peripheral>I2C2</peripheral>
      <peripheral>I2C3</peripheral>
      <peripheral>I2C4</peripheral>
      <peripheral>I2C5</peripheral>
      <peripheral>I2C6</peripheral>
      <peripheral>I2S1</peripheral>
      <peripheral>I2S2</peripheral>
      <peripheral>I2S3</peripheral>
      <peripheral>IPCC</peripheral>
      <peripheral>IWDG1</peripheral>
      <peripheral>IWDG2</peripheral>
      <peripheral>LPTIM1</peripheral>
      <peripheral>LPTIM2</peripheral>
      <peripheral>LPTIM3</peripheral>
      <peripheral>LPTIM4</peripheral>
      <peripheral>LPTIM5</peripheral>
      <peripheral>LTDC</peripheral>
      <peripheral>OPENAMP</peripheral>
      <peripheral>PWR</peripheral>
      <peripheral>QUADSPI</peripheral>
      <peripheral>RCC</peripheral>
      <peripheral>RESMGR_UTILITY</peripheral>
      <peripheral>RNG1</peripheral>
      <peripheral>RNG2</peripheral>
      <peripheral>RTC</peripheral>
      <peripheral>SAI1</peripheral>
      <peripheral>SAI2</peripheral>
      <peripheral>SAI3</peripheral>
      <peripheral>SAI4</peripheral>
      <peripheral>SDMMC1</peripheral>
      <peripheral>SDMMC2</peripheral>
      <peripheral>SDMMC3</peripheral>
      <peripheral>SPDIFRX</peripheral>
      <peripheral>SPI1</peripheral>
      <peripheral>SPI2</peripheral>
      <peripheral>SPI3</peripheral>
      <peripheral>SPI4</peripheral>
      <peripheral>SPI5</peripheral>
      <peripheral>SPI6</peripheral>
      <peripheral>SYS</peripheral>
      <peripheral>TAMP</peripheral>
      <peripheral>TIM1</peripheral>
      <peripheral>TIM2</peripheral>